{
  "$schema": "./schemas/global.schema.json",
  "project": "crypto-trader",
  "description": "Fullstack crypto trading platform",
  "version": "0.1.0",
  "completed_modules": [
    {
      "module": "trading-agents-core",
      "spec": "spec-e-burgos-001-agents-simplification",
      "apps": [
        "apps/api",
        "apps/web",
        "libs/trading-engine",
        "libs/analysis",
        "libs/data-fetcher",
        "libs/shared",
        "libs/openrouter"
      ],
      "cycles_completed": 3,
      "description": "Simplificacion del nucleo de agentes (poda de subsistemas muertos y observabilidad de costo), venta inteligente con gestion activa de riesgo y ordenes de proteccion nativas, y reduccion del costo LLM por decision (gate determinista pre-LLM, cache compartido de senal, max_tokens por tarea y costo real por decision visible por bot/dia)",
      "completed_at": "2026-08-18"
    },
    {
      "module": "market-data-credentials",
      "spec": "spec-e-burgos-004-data-source-credentials",
      "apps": [
        "apps/api",
        "apps/web",
        "libs/shared"
      ],
      "description": "Resolucion hibrida de credenciales de data sources: cascada unica propia -> admin compartida -> fuente omitida, aislamiento de cache/rate-limit/circuito por dueno de credencial, y self-service del trader",
      "cycles_completed": 1,
      "completed_at": "2026-08-19"
    },
    {
      "module": "infra-hetzner-cloudflare",
      "spec": "spec-e-burgos-008-infra-hetzner-cloudflare",
      "apps": [
        "apps/api",
        "apps/web"
      ],
      "description": "Migracion de Railway + GitHub Pages a Hetzner + Cloudflare, cerrada en 4 ciclos el 2026-09-01. VPS CX23 en Helsinki con Postgres pgvector y Redis autoalojados sin puerto publico, backups horarios a Cloudflare R2 con restore verificado en base descartable, API y SPA sirviendo en el mismo origen detras de nginx con Let's Encrypt renovado por cron, deploy por GitHub Actions a GHCR, y chequeo diario que avisa por la tabla Notification cuando algo falla en silencio. Dos fases se reescribieron sobre la marcha y quedaron registradas como decisiones: la Fase 4 (migrar datos) se CANCELO porque el trial de Railway vencio y no habia via tecnica de extraccion, asi que la base arranca vacia; y la Fase 6 dejo Cloudflare Pages afuera para servir la SPA desde el propio VPS, que es lo que elimina CORS. Correr ciclos reales del agente durante la verificacion destapo tres defectos que llevaban meses en el arbol y que ninguna suite detectaba, cerrados por FIX GATE: el gate de riesgo AEGIS fallaba ABIERTO, el indice vectorial del RAG no existia, y el costo LLM no se guardaba en las decisiones manuales. Queda pendiente del dueno borrar el proyecto de Railway, que ya no corre nada",
      "cycles_completed": 4,
      "completed_at": "2026-09-01"
    },
    {
      "module": "reactive-execution-loop",
      "spec": "spec-e-burgos-005-reactive-execution-loop",
      "apps": [
        "apps/api",
        "libs/data-fetcher",
        "libs/trading-engine",
        "libs/analysis",
        "libs/shared"
      ],
      "description": "Loop de ejecucion dirigido por precio, cerrado en 2 ciclos el 2026-09-01. cycle-01 (2026-08-30) entrego las cinco capas de la SALIDA: despertar por evento material sobre el stream de mercado en vivo, fast path deterministico que ejecuta reflejos sin LLM, caps duros de frecuencia fuera del alcance del LLM y deteccion de staleness del stream con fallback a temporizador + REST; todo nace apagado detras de reactiveLoopEnabled. cycle-02 (2026-09-01) cierra la asimetria empujando tambien la ENTRADA al exchange: LIMIT_MAKER colocable en el soporte, OCO de entrada (LIMIT_MAKER por debajo + STOP_LOSS_LIMIT de ruptura por arriba) y trailingDelta en BIPS sobre la pierna contingente, con la entrada persistida en la tabla entry_orders, su fill reconciliado a Position + Trade + proteccion inicial aunque el servicio haya estado caido, contabilidad en bot_actions sin doble conteo (la colocacion pasa por la puerta como BUY, el fill se audita con source EXCHANGE_TRIGGER y no alimenta los caps) y sonda de fill por tick para acortar la ventana sin proteccion. Todo detras de TradingConfig.entryOrderMode, que nace en MARKET y cierra el ciclo en MARKET: con el default el comportamiento observable es identico al previo. Verificado ejecutando contra Binance TESTNET en tres niveles -- probe crudo con fetch+HMAC, harness del cliente en libs/data-fetcher y spec integrado con Prisma real en apps/api -- sin tocar una sola clave LIVE",
      "cycles_completed": 2,
      "completed_at": "2026-09-01"
    },
    {
      "module": "agent-advanced-config-ui",
      "spec": "spec-e-burgos-009-agent-advanced-config-ui",
      "apps": [
        "apps/web",
        "libs/shared",
        "libs/ui"
      ],
      "description": "La SPA del trader queda alineada con el backend reactivo, cerrada en 2 ciclos. cycle-01 (2026-09-03) publico el wire de TradingConfig en libs/shared, borro la interface local de apps/web y expuso los 25 campos de configuracion avanzada (proteccion nativa, senal y tamano, loop reactivo, entrada) en alta, edicion y detalle del agente, siempre apagados por defecto y con las reglas de coherencia visibles (SANDBOX vs LIVE/TESTNET, OCO vs LIMIT_MAKER); descubrio y corrigio de paso que el POST persistia solo 18 de los 40 campos del DTO (FIX-026) y que un PUT con isActive respondia 500 (FIX-027). cycle-02 (2026-09-04) consumio EP-017 sin tocar un solo endpoint: tercera pestana Entradas en Posiciones con la URL como fuente de verdad (tab/status/configId/entryOrderId), filtros por estado y por bot server-side, paginado por cursor acumulado, degradacion a neutro de todo estado, motivo o modo fuera del wire, tiempo real por los seis eventos entry-order:* invalidando por prefijo, entrada RESTING vigente en el detalle del agente y las tres notificaciones de entradas enlazando a la vista con un unico getNotificationRoute. Verificado con 493 tests en apps/web (64 combinaciones generadas de estado x modo x motivo/pierna), E2E headless en CI y produccion respondiendo 200 en GET /trading/entry-orders.",
      "cycles_completed": 2,
      "completed_at": "2026-09-04"
    }
  ],
  "in_progress_modules": [
    {
      "module": "user-data-stream-fills",
      "spec": "spec-e-burgos-010-user-data-stream-fills",
      "apps": [
        "apps/api",
        "libs/data-fetcher",
        "libs/shared"
      ],
      "cycles_completed": 0,
      "description": "Deteccion de fills de ordenes de entrada por el user data stream de Binance (listenKey + executionReport) en lugar de la sonda por tick, con reconciliacion idempotente, fallback a la sonda cuando el stream no esta sano y todo detras de un interruptor que nace apagado"
    }
  ],
  "pending_modules": [],
  "monorepo": {
    "tool": "Nx",
    "package_manager": "pnpm",
    "apps": {
      "api": "apps/api — app",
      "api-e2e": "apps/api-e2e — app",
      "web": "apps/web — app",
      "web-e2e": "apps/web-e2e — app"
    },
    "libs": {
      "analysis": "libs/analysis — lib",
      "data-fetcher": "libs/data-fetcher — lib",
      "trading-engine": "libs/trading-engine — lib",
      "openrouter": "libs/openrouter — lib",
      "providers": "libs/providers — lib",
      "shared": "libs/shared — lib",
      "ui": "libs/ui — lib"
    }
  }
}
